Search,Cost,Clicks,Impressions,Conversions
notary near me,$11.97,6,142,0.00
notary public near me,$8.28,4,28,0.00
mobile notary,$3.99,2,13,0.00
mobile notary moorpark,$4.40,2,1,0.00
notary los angeles,$4.34,2,1,0.00
public notary,$4.32,2,2,0.00
public notary near me,$3.95,2,13,0.00
traveling notary near me,$3.91,2,5,0.00
24 hour notary near me,$2.00,1,1,0.00
a mobile notary public,$1.95,1,1,0.00
dfw mobile notary,$1.96,1,1,0.00
how much are mobile notaries,$2.19,1,1,0.00
local notary public near me,$1.98,1,1,0.00
mobile notary fee,$1.98,1,1,0.00
mobile notary near me,$1.97,1,9,0.00
mobile notary publics,$1.98,1,1,0.00
mobilenotary,$1.98,1,1,0.00
notaries near me,$1.95,1,6,0.00
same day apostille service los angeles,$6.52,1,8,0.00
where do i notarize a document,$1.97,1,1,0.00
a1 mobile notary lake charles,$0.00,0,1,0.00
best place to get a notary,$0.00,0,1,0.00
closest notary to my location,$0.00,0,1,0.00
cost of mobile notary,$0.00,0,1,0.00
how much do mobile notary charge,$0.00,0,1,0.00
how much does it cost for a notary to come to your house,$0.00,0,1,0.00
how much is a mobile notary,$0.00,0,1,0.00
i need a notary near me,$0.00,0,1,0.00
local notary,$0.00,0,1,0.00
local notary near me,$0.00,0,1,0.00
local notary services near me,$0.00,0,1,0.00
mobile notaries near me,$0.00,0,1,0.00
mobile notary atlanta ga,$0.00,0,1,0.00
mobile notary columbus ohio,$0.00,0,1,0.00
mobile notary huntington beach,$0.00,0,1,0.00
mobile notary massachusetts,$0.00,0,1,0.00
mobile notary public,$0.00,0,1,0.00
mobile notary republic,$0.00,0,1,0.00
mobile notary riverside,$0.00,0,1,0.00
mobile notary san antonio price,$0.00,0,1,0.00
mobile notary service,$0.00,0,1,0.00
mobile notary services,$0.00,0,3,0.00
mobile notary websites,$0.00,0,1,0.00
near notary services,$0.00,0,1,0.00
nearest notary to me,$0.00,0,1,0.00
nj mobile notary fees,$0.00,0,1,0.00
notaries close to me,$0.00,0,2,0.00
notario publico near me,$0.00,0,5,0.00
notarios publicos near me,$0.00,0,2,0.00
notarize documents near me,$0.00,0,1,0.00
notarize near me,$0.00,0,1,0.00
notarized near me,$0.00,0,1,0.00
notary in person,$0.00,0,1,0.00
notary mobile,$0.00,0,1,0.00
notary nearby,$0.00,0,1,0.00
notary office near me,$0.00,0,1,0.00
notary public los angeles,$0.00,0,1,0.00
notary service,$0.00,0,2,0.00
notary services,$0.00,0,1,0.00
notary services near me,$0.00,0,13,0.00
notary services open now,$0.00,0,1,0.00
notary that comes to you near me,$0.00,0,2,0.00
notary that will come to you,$0.00,0,1,0.00
places that notarize near me,$0.00,0,1,0.00
public notary near me open now,$0.00,0,2,0.00
remote mobile notary,$0.00,0,1,0.00
same day apostille la,$0.00,0,2,0.00
same day apostille la los angeles,$0.00,0,4,0.00
same day apostille los angeles,$0.00,0,1,0.00
sathish notary,$0.00,0,1,0.00
traveling notary,$0.00,0,1,0.00
traveling notary services,$0.00,0,1,0.00
travelling notary public near me,$0.00,0,1,0.00
where are notary publics,$0.00,0,1,0.00
where can i get a letter notarized near me,$0.00,0,1,0.00
where can i get a notary near me,$0.00,0,2,0.00
where can i notarize,$0.00,0,1,0.00
where can you get a form notarized,$0.00,0,1,0.00
where to find a notary near me,$0.00,0,1,0.00
where to get notarized,$0.00,0,1,0.00
where to go to notarize a document,$0.00,0,1,0.00
who can notarize documents near me,$0.00,0,1,0.00
who provides notary services,$0.00,0,1,0.00
will notary near me,$0.00,0,2,0.00
